[
  {
    "id": "modo:100-todoslospagos-ciudad-septiembre26",
    "fuente": "modo",
    "titulo": "100% 3 primeras compras App Ciudad",
    "proveedor": "Banco Ciudad",
    "categoria": "Comercios",
    "descuento_texto": "100% de reintegro",
    "tipo_descuento": "porcentaje",
    "porcentaje": "100",
    "tope": "6000",
    "tope_moneda": "ARS",
    "tope_periodo": "month",
    "tope_cantidad": null,
    "tope_unidad": null,
    "vigencia_desde": "2026-09-07T03:00:00.000Z",
    "vigencia_hasta": "2026-09-30T03:00:00.000Z",
    "vigente": true,
    "medio_pago": null,
    "banco": "Banco Ciudad",
    "membresia": null,
    "requisitos": [],
    "descripcion": "Activá en septiembre y llevate un beneficio exclusivo.",
    "descripcion_texto": "100% de reintegro en pagos QR con App Ciudad.",
    "online": false,
    "canales": "presencial",
    "actualizado_en": "2026-09-08T12:00:00.000Z"
  },
  {
    "id": "descuentito:supermercados-martes",
    "fuente": "descuentito",
    "titulo": "15% en supermercados los martes",
    "proveedor": "Supermercados",
    "categoria": "Supermercados",
    "descuento_texto": "15% de descuento",
    "tipo_descuento": "porcentaje",
    "porcentaje": "15",
    "tope": "3000",
    "tope_moneda": "ARS",
    "tope_periodo": "week",
    "tope_cantidad": null,
    "tope_unidad": null,
    "vigencia_desde": "2026-10-01T03:00:00.000Z",
    "vigencia_hasta": "2026-12-31T03:00:00.000Z",
    "vigente": true,
    "medio_pago": "Visa",
    "banco": null,
    "membresia": null,
    "requisitos": ["Pago con tarjeta Visa"],
    "descripcion": "Válido todos los martes.",
    "descripcion_texto": "15% de descuento en supermercados adheridos.",
    "online": null,
    "canales": "presencial",
    "actualizado_en": "2026-10-01T10:00:00.000Z"
  }
]
